id,description,games,name,character_gender,obfuscated_description
1832,"Angio is an amateur singer who resembles a young Jezz Torrent (as he appeared in GTA Vice City) and even sings one of his solos. The Judges initially insult William after his performance with two of the judges voting it ""Shame"" but after Lazlow begs everyone to do something controversial to get ratings, Hugh Harrison votes William ""fame"" and the other judges follow suit despite already making their votes. Hugh then asks William to punch Lazlow, which he does twice.",[1020],William Angio - Fame or Shame,0,"<the character> is an amateur singer who resembles a young <the character> (as <he> appeared in <The game>) and even sings one of <his> solos. The Judges initially insult <the character> after <his> performance with two of the judges voting it ""Shame"" but after <the character> begs everyone to do something controversial to get ratings, <the character> votes <the character> ""fame"" and the other judges follow suit despite already making their votes. <the character> then asks <the character> to punch <the character>, which <he> does twice."
3317,"Johnny Joestar is the protagonist of Steel Ball Run and a minor character in JoJolion. He is the seventh JoJo of the JoJo's Bizarre Adventure series. 
 
Johnny is a young man of below-average height and slim to medium build. He has light eyes, and light, shoulder-length hair curling upwards at its ends. 
 
Johnny always wears a knit capW, printed with many small five-pointed stars. His hair sticks out of holes on either side of the top, taking a shape like short horns. A horseshoe hangs from the front; framing an image of the dark silhouette of the profile of a horse's reared head. 
 
Johnny wears similarly star-patterned pants; of a piece with footwear bearing spursW. He commonly wears a light-colored, hooded, short-sleeved top; printed with thick lines in the approximate formation of a harness (later, with patches in the shape of hearts adorning both shoulders). A long feather (bordered by black with one black spot at its tip) emerges from under the back of his collar; and he wears wrist cuffs patterned with stars and stripes. 
 
Johnny Joestar is a depressive ex-jockey, who clings to his hope of regaining the use of his legs through the Spin and then the Corpse Part throughout Steel Ball Run. 
 
Johnny is introduced as a distant paraplegic man whose career was ruined when he was shot in the spine after conceitedly antagonizing a passerby. After Johnny witnesses Gyro's Steel Balls and Spin, and how they enabled him to stand up on his feet for a moment, he becomes determined to follow him and make him teach the Spin, then after discovering the Corpse Part making his legs twitch, to acquire them.",[6517],Johnny Joestar,0,"<the character> is the protagonist of <The game> and a minor character in <The game>. <he/she/they> is the seventh <the character> of the <The game> series. 

<the character> is a young man of below-average height and slim to medium build. <he/she/they> has light eyes, and light, shoulder-length hair curling upwards at its ends. 

<the character> always wears a knit cap, printed with many small five-pointed stars. <his/her/their> hair sticks out of holes on either side of the top, taking a shape like short horns. A horseshoe hangs from the front; framing an image of the dark silhouette of the profile of a horse's reared head. 

<the character> wears similarly star-patterned pants; of a piece with footwear bearing spurs. <he/she/they> commonly wears a light-colored, hooded, short-sleeved top; printed with thick lines in the approximate formation of a harness (later, with patches in the shape of hearts adorning both shoulders). A long feather (bordered by black with one black spot at its tip) emerges from under the back of <his/her/their> collar; and <he/she/they> wears wrist cuffs patterned with stars and stripes. 

<the character> is a depressive ex-jockey, who clings to <his/her/their> hope of regaining the use of <his/her/their> legs through the Spin and then <an artifact> throughout <The game>. 

<the character> is introduced as a distant paraplegic man whose career was ruined when <he/she/they> was shot in the spine after conceitedly antagonizing a passerby. After <the character> witnesses <the character>'s <an artifact> and Spin, and how they enabled <him/her/them> to stand up on <his/her/their> feet for a moment, <he/she/they> becomes determined to follow <him/her> and make <him/her> teach the Spin, then after discovering <an artifact> making <his/her> legs twitch, to acquire them."
12330,"Arthur Morgan is a central character and the main protagonist of Red Dead Redemption 2. Arthur Morgan was born circa 1863 to Beatrice and Lyle Morgan, somewhere in the northern United States. Around 1877, Arthur was found and picked up of the streets by Dutch van der Linde and Hosea Matthews.",[25076],Arthur Morgan,0,"<the character> is a central character and the main protagonist of <The game>. <the character> was born circa 1863 to <a parent> and <a parent>, somewhere in the northern United States. Around 1877, <the character> was found and picked up off the streets by <a person> and <a person>."
4907,"The mascot species of the Pokémon franchise, Pikachu is an Electric-type rodent that evolves from Pichu and can later evolve into Raichu. Pikachu has been extensively featured in nearly every piece of Pokémon media, and its popularity extends outside of its home series - it has been playable in every Super Smash Bros. game, painted on commercial airliners, and has its own balloon in the Macy's Thanksgiving Day Parade.","[2289, 1512, 2290]",Pikachu,2,"The mascot species of <The game> franchise, <the character> is an Electric-type rodent that evolves from <a creature> and can later evolve into <a creature>. <the character> has been extensively featured in nearly every piece of <The game> media, and its popularity extends outside of its home series – it has been playable in every <The game> game, painted on commercial airliners, and has its own balloon in the Macy's Thanksgiving Day Parade."
2629,"His past is not known but he is known to the public as an important government official and the Director of FEMA. He was appointed to FEMA through Page's manipulation of an unnamed senator infected with the Gray Death, and went to work immediately. A cloak-and-dagger man, Simons was the first higher-up on the scene after JC Denton's capture of NSF operatives in Battery Park; his interrogation ended with Simons personally executing both prisoners.",[41],Walton Simons,0,"<his> past is not known but <he> is known to the public as an important government official and the Director of <an organization>. <he> was appointed to <an organization> through <a person>'s manipulation of an unnamed senator infected with <a disease>, and went to work immediately. A cloak-and-dagger <man>, <the character> was the first higher-up on the scene after <a person>'s capture of <an organization> operatives in <a location>; <his> interrogation ended with <the character> personally executing both prisoners."
12822,"Peach (or Princess Peach) is a main protagonist in the Mario series. She's usually the damsel-in-distress of the games, who the players have to rescue, but she also has some important roles as the hero herself. She's the adorable and cute princess of the Mushroom Kingdom.",[26758],Peach,1,"<the character> is a main protagonist in <The game>. <she> is usually the damsel-in-distress of the games, who the players have to rescue, but <she> also has some important roles as the hero <herself>. <she> is the adorable and cute princess of <a location>."
8707,"""Post Tenebras Veritas"" - Grayson's motto.
----

Grayson (his full name is never said. It is unknown whether Grayson is his first name, surname, or a pseudonym.) , formerly known as Sir Galahad is the main protagonist in The Order: 1886, a Knight of The Order and the third 'Sir Galahad', before being convicted of sedition against the establishment. He is a protégé of Sebastien Malory and after showing great skill and promise, he readily climbed up the internal ranks of The Order, and began to train his own protégé, Isabeau D'Argyll. Soon, Isabeau was knighted 'Lady Igraine', and they shortly developed romantic feelings for one another. Sadly, it was forbidden by law for them to have a relationship.

There's not a lot of info about Grayson's history in the narrative. The only implications of his origins are from an exchange with Sebastien where he states, ""That was before even my time. The city walls had yet to come up"".

Later, Sebastien dies and Grayson forms a pact with Alastair D'Argyll, calling each other 'brothers'. He however, made the mistake in sharing incriminating information without knowing that Alastair was a Half-breed. This forced Alastair to betray Grayson in favor of assuring the survival of his species.

Galahad is a serious figure, with undying loyalty to The Order. He's an expert tracker and hunter. However, under the service, self-doubt and concert exists. Jaded and numb to the violence he witnessed day-to-day, Galahad is world-weary with a calm, cool, professional demeanor.

After Sebastien's death, Galahad lost his calmness and turned vengeful, going ballistic on a rebel fighter until he spilled the leader's location. After learning the truth of Alastair's past, and not being able to tell the Council, he left the title 'Sir Galahad'.",,Grayson / Sir Galahad,0,"""Post Tenebras Veritas"" - <the character>'s motto.
----

<the character> ( <his> full name is never said. It is unknown whether <the character>'s name is a first name, surname, or a pseudonym.) , formerly known as <the character> is the main protagonist in <The game>, a Knight of <an organization> and the third '<the character>', before being convicted of sedition against the establishment. <he> is a protégé of <a character> and after showing great skill and promise, <he> readily climbed up the internal ranks of <an organization>, and began to train <his> own protégé, <a character>. Soon, <a character> was knighted '<a character>', and they shortly developed romantic feelings for one another. Sadly, it was forbidden by law for them to have a relationship.

There's not a lot of info about <the character>'s history in the narrative. The only implications of <his> origins are from an exchange with <a character> where <he> states, ""That was before even my time. The city walls had yet to come up"".

Later, <a character> dies and <the character> forms a pact with <a character>, calling each other 'brothers'. <he> however, made the mistake in sharing incriminating information without knowing that <a character> was a Half-breed. This forced <a character> to betray <the character> in favor of assuring the survival of <their> species.

<the character> is a serious figure, with undying loyalty to <an organization>. <he> is an expert tracker and hunter. However, under the service, self-doubt and concert exists. Jaded and numb to the violence <he> witnessed day-to-day, <the character> is world-weary with a calm, cool, professional demeanor.

After <a character>'s death, <the character> lost <his> calmness and turned vengeful, going ballistic on a rebel fighter until <he> spilled the leader's location. After learning the truth of <a character>'s past, and not being able to tell <an organization>, <he> left the title '<the character>'."
4365,"Mileena is a character in the Mortal Kombat series. A genetic experiment created by the sorcerer Shang Tsung, she is one of the adopted daughters of the Outworld Emperor Shao Kahn and one of his personal enforcers. She has served as an antagonist throughout the series.",[7292],Mileena,1,"<the character> is a character in <The game>. A genetic experiment created by a sorcerer, <she> is one of the adopted daughters of the ruler of <a location> and one of <her> personal enforcers. <she> has served as an antagonist throughout <The game>."
6,"Commander Shepard is the player character in BioWare's Mass Effect game trilogy: Mass Effect, Mass Effect 2, and Mass Effect 3. A veteran soldier of the Systems Alliance Navy military and N7-graduate of the Interplanetary Combatives Training (ICT) program, and the first human Citadel Council Spectre, Shepard works to stop ""the Reapers"", a sentient synthetic-machine race dedicated to wiping out all organic life.

Shepard's gender, class, first name and general appearance are chosen and customized by the player. Since the player can choose the gender of Shepard, much of the dialogue revolving around the character is gender neutral with only a few exceptions.","[73, 74]",Commander Shepard (female),1,"<the character> is the player character in <The game>. A veteran soldier of <an organization> and <an organization>-graduate of <an organization>, and the first human <an organization> Spectre, <the character> works to stop <an organization>, a sentient synthetic-machine race dedicated to wiping out all organic life.

<the character>'s gender, class, first name and general appearance are chosen and customized by the player. Since the player can choose the gender of <the character>, much of the dialogue revolving around the character is gender neutral with only a few exceptions."
14389,"Link is the main protagonist in The Legend of Zelda series. He's usually the hero of the game, and the player's avatar.",[116419],Link,0,"<the character> is the main protagonist in <The game>. <he/she/they> is usually the hero of the game, and the player's avatar."
1401,Prince of Ylisse,[1443],Chrom,0,<The game>
10,"Commander Shepard is the player character in BioWare's Mass Effect game trilogy: Mass Effect, Mass Effect 2, and Mass Effect 3. A veteran soldier of the Systems Alliance Navy military and N7-graduate of the Interplanetary Combatives Training (ICT) program, and the first human Citadel Council Spectre, Shepard works to stop ""the Reapers"", a sentient synthetic-machine race dedicated to wiping out all organic life.

Shepard's gender, class, first name and general appearance are chosen and customised by the player. Mark Meer provides the voice for male Shepards, while Jennifer Hale voices females. Since the player can choose the gender of Shepard, much of the dialogue revolving around the character is gender neutral with only a few exceptions.

Alan Shepard was the source of the character's name. Shepard's armour developed over the series, and was originally intended to be red-and-white. Though both genders were given equal importance during development, marketing felt there was a need for a single identifiable hero for promotion of the game. Various merchandise has been made, including several figurines. Shepard has appeared in cameo appearances in other Electronic Arts games, though they will not be appearing in any future Mass Effect ones.","[73, 74]",Commander Shepard (male),0,"Commander <the character> is the player character in <The game> trilogy: <The game>, <The game> 2, and <The game> 3. A veteran soldier of <an organization> military and N7‑graduate of the <an organization> program, and the first human <a location> Council Spectre, <the character> works to stop ""<an organization>"", a sentient synthetic‑machine race dedicated to wiping out all organic life.

<the character>'s gender, class, first name and general appearance are chosen and customised by the player. <a person> provides the voice for male <the character>s, while <a person> voices females. Since the player can choose the gender of <the character>, much of the dialogue revolving around <the character> is gender neutral with only a few exceptions.

<a person> was the source of <the character>'s name. <the character>'s armour developed over the series, and was originally intended to be red‑and‑white. Though both genders were given equal importance during development, marketing felt there was a need for a single identifiable hero for promotion of the game. Various merchandise has been made, including several figurines. <the character> has appeared in cameo appearances in other <an organization> games, though they will not be appearing in any future <The game> ones."
9,"Garrus Vakarian is a turian, formerly part of C-Sec's Investigation Division. Like most turians, Garrus had his military training at fifteen, but later followed in his father's footsteps to become a C-Sec officer. He was responsible for the investigation of Saren Arterius, the Council's top Spectre, after the Alliance claimed Saren had gone rogue. Although Garrus was told that the investigation was over, he decided to defy the Executor's order and pursue another lead on his own. Eventually, Garrus attempts to join Commander Shepard's team to help defeat Saren and the geth.","[73, 74]",Garrus Vakarian,0,"<the character> is a turian, formerly part of <an organization>'s Investigation Division. Like most turians, <the character> had <his/her/their> military training at fifteen, but later followed in <his/her/their> father's footsteps to become a <an organization> officer. <the character> was responsible for the investigation of Saren Arterius, the Council's top Spectre, after the Alliance claimed Saren had gone rogue. Although <the character> was told that the investigation was over, <he/she/they> decided to defy the Executor's order and pursue another lead on <his/her/their> own. Eventually, <the character> attempts to join Commander Shepard's team to help defeat Saren and the geth."
7841,"Ragna the Bloodedge is the main protagonist of the BlazBlue series from Calamity Trigger to Central Fiction. He harbors a deep hatred of the Novus Orbis Librarium and aims to annihilate the organization. In turn, the NOL places the highest-ever bounty in history on his head. Ragna possesses a powerful form of ars magus (magic weapon) called the Azure Grimoire or BlazBlue which is central to the main conflict of the series.","[6750, 51448]",Ragna the Bloodedge,0,"<the character> is the main protagonist of <The game> from <a past event> to <a past event>. <he/she/they> harbors a deep hatred of <an organization> and aims to annihilate <an organization>. In turn, <an organization> places the highest‑ever bounty in history on <his/her/their> head. <the character> possesses a powerful form of ars magus (magic weapon) called <an artifact> which is central to the main conflict of <The game>."
15028,"Edelgard is a playable character and one of the main protagonists in Fire Emblem: Three Houses. She is the princess and the future emperor of the Adrestian Empire. In the Officers Academy, she is the leader of the Black Eagles.",[26845],Edelgard,1,"<the character> is a playable character and one of the main protagonists in <The game>. <she> is the princess and the future emperor of <a location>. In <a location>, <she> is the leader of <an organization>."
9357,"Trailer for the Kickstarter game "" HIDE OR DIE "" available soon. 
 
Asymmetric Horror has never been more frightening.",,Trailer voice,2,"Trailer for the Kickstarter game ""<The game>"" available soon.

Asymmetric Horror has never been more frightening."
3325,"Josuke Higashikata 8 is the protagonist of JoJolion. He is the eighth JoJo of the JoJo's Bizarre Adventure series. 
 
Josuke is a young man afflicted with retrograde amnesia, lacking any memories prior to being discovered by Yasuho Hirose near the Wall Eyes in Morioh Town. He dedicates himself to discovering his former identity and those originally associated with him. 
 
Josuke is a young, handsome and physically fit man of above-average height. 
 
He wears a tasseled ""Dixie cup"" sailor cap (in multiple illustrations, it is adorned with the same palm insignia as Jotaro Kujo's hat). He wears a sailor suit, cut with a wide neck and above the navel, a neckerchief with a button resembling a slotted screw head, large emblems of an anchor on his right side and a compass rose on his left, fitted pants with a belt, and a pair of high-top athletic shoes. 
 
After partaking in an equivelant exchange to save his life. Josuke has segmented rocks which form a running stich going down his left side, passing through his eye. 
 
The tentatively named Josuke Higashikata is a quirky amnesiac determined to learn his true identity and his past. 
 
Josuke is afflicted by extensive retrograde amnesia, lacking memory of himself or events prior to meeting Yasuho Hirose, but retaining various degrees of knowledge. As such, Josuke is driven to discover who he was by investigating the circumstances of his presence in the beach prior to having been saved by Yasuho; that goal occupy nearly all of his activities and no action on his part isn't made without approaching him of learning the truth. That drive is sufficiently strong that he was willing to interrupt a rare moment with his love interest Yasuho to investigate Karera Sakunami. After learning about his past identity, Josuke set for himself the new goal of retrieving the Locacaca branch and use the fruit to heal Holy Joestar-Kira. He still demonstrates the same steadfastness in investigating the fruit and the whereabouts of the Locacaca Organization, with the addition of deferring more to Rai Mamezuku's opinions, deeming the plant appraiser's expertise about the fruit worth listening to. His determination to reach his goals is best illustrated when he willingly steps into a rain made deadly by Satoru Akefu's Stand, letting his body being pierced by raindrops including his head just to reach the hospital.",[6517],Josuke Higashikata 8,0,"<the character> is the protagonist of <The game>. <he/she/they> is the eighth <person> of the <The game> series.

<the character> is a young <man/woman/person> afflicted with retrograde amnesia, lacking any memories prior to being discovered by <a person> near <a location> in <a location>. <the character> dedicates <himself/herself/themselves> to discovering <their> former identity and those originally associated with <them>.

<the character> is a young, handsome and physically fit <man/woman/person> of above‑average height.

<the character> wears a tasseled “Dixie cup” sailor cap (in multiple illustrations, it is adorned with the same palm insignia as <a person>’s hat). <the character> wears a sailor suit, cut with a wide neck and above the navel, a neckerchief with a button resembling a slotted screw head, large emblems of an anchor on <their> right side and a compass rose on <their> left, fitted pants with a belt, and a pair of high‑top athletic shoes.

After partaking in an equivalent exchange to save <their> life, <the character> has segmented rocks which form a running stitch down <their> left side, passing through <their> eye.

The tentatively named <the character> is a quirky amnesiac determined to learn <their> true identity and <their> past.

<the character> is afflicted by extensive retrograde amnesia, lacking memory of <themselves> or events prior to meeting <a person>, but retaining various degrees of knowledge. As such, <the character> is driven to discover who <they> were by investigating the circumstances of <their> presence in the beach prior to having been saved by <a person>; that goal occupies nearly all of <their> activities and no action on <their> part isn’t made without approaching <them> of learning the truth. That drive is sufficiently strong that <the character> was willing to interrupt a rare moment with <their> love interest <a person> to investigate <a location>. After learning about <their> past identity, <the character> set for <themselves> the new goal of retrieving <an artifact> and use <an artifact> to heal <an artifact>. <the character> still demonstrates the same steadfastness in investigating <an artifact> and the whereabouts of <an organization>, with the addition of deferring more to <a person>’s opinions, deeming the plant appraiser’s expertise about <an artifact> worth listening to. <their> determination to reach <their> goals is best illustrated when <the character> willingly steps into a rain made deadly by <an artifact>, letting <their> body being pierced by raindrops including <their> head just to reach the hospital."
2050,"Talion is one of the two player-controlled protagonists in both Middle-earth: Shadow of Mordor and Middle-earth: Shadow of War, alongside Celebrimbor. However, they share the same body. 
 
A descendant of the Northmen in Rhovanion, and raised in Minas Tirith, he is a loyal Ranger of Gondor, where he then rose the rank of Captain of the Black Gate. After the tragic demise of his family and himself, Talion was revived by Celebrimbor, an immensely powerful Wraith; where the two joined forces and began a quest for vengeance on those responsible for the death of his loved ones the Black Hand of Sauron.",[3025],Talion,0,"<the character> is one of the two player‑controlled protagonists in both <The game> and <The game>, alongside <another character>. However, they share the same body. 

A descendant of the Northmen in <a location>, and raised in <a location>, <he> is a loyal <an organization> of <an organization>, where <he> then rose the rank of Captain of <a location>. After the tragic demise of <his> family and <himself>, <the character> was revived by <another character>, an immensely powerful Wraith; where the two joined forces and began a quest for vengeance on those responsible for the death of <his> loved ones <an organization>."
