id,description,games,name,character_gender,obfuscated_description
3466,"If you play The Walking Dead: Season One by Telltale Games, you will meet Omid who is one of the many main characters. Omid is very friendly, kind-hearted and loving. He cares deeply for his girlfriend, Christa. Even though the world is going to hell, Omid has a positive view on life and tries to stay strong for others around him. He is often seen as the comic-relief of the group, and tries hard to lift the spirits of his companions. However he's not into heavy and troubling topics and tries to avoid it as much as possible. Additionally, Omid is assumed to be really intelligent, and is really into Civil War history. 

Before the zombie apocalypse, him and Christa shared an apartment in San Francisco. They owned a pet cat and enjoyed to travel. When the dead started to walk on the earth, they were on an ""all American road trip"". They went to Barstow, and had a Vegas Weekend together. Not much else is known about their past lives.

Christa and Omid later becomes Clementine's guardian &amp; swears to protect her.","[3097, 1871]",Omid,0,"If you play <The game> by Telltale Games, you will meet <the character> who is one of the many main characters. <the character> is very friendly, kind‑hearted and loving. <he/she/they> cares deeply for <his/her/their> girlfriend, <another character>. Even though the world is going to hell, <the character> has a positive view on life and tries to stay strong for others around <he/she/they>. <he/she/they> is often seen as the comic‑relief of the group, and tries hard to lift the spirits of <his/her/their> companions. However <he/she/they>'s not into heavy and troubling topics and tries to avoid it as much as possible. Additionally, <the character> is assumed to be really intelligent, and is really into Civil War history.

Before the zombie apocalypse, <he/she/they> and <another character> shared an apartment in <a location>. They owned a pet cat and enjoyed to travel. When the dead started to walk on the earth, they were on an “all American road trip”. They went to <a location>, and had a <a location> weekend together. Not much else is known about their past lives.

<another character> and <the character> later become <another character>'s guardian & swears to protect <his/her/their>."
11936,"Grand Arch Master of the Order of One. 
 
Dupoint Lucroix is the Grand Master trying to keep order while his assistant Alexander seeks to use the evils of mankind to better himself.",,Grand Master Dupoint Lucroix,2,"Grand Arch Master of <an organization>.

<the character> is the Grand Master trying to keep order while the assistant seeks to use the evils of mankind to better <himself/herself/themselves>."
3472,"In Telltale Games' The Walking Dead, there's many main characters and one of them is Kenny. As a kid he was raised by his father, who taught him how to repair broken cars. That knowledge soon extended to boats due to his love of the water and traveling. As an adult, Kenny became a commercial fisherman, hunting for the snapper fish and yellow fin. During a fishing trip, he found a sick octopus and decided to bring it to a veterinarian's office. There he met and fell in love with Katjaa. They got married and later had a son called Kenny Jr, also nicknamed Duck. The family were returning from Memphis, Tennessee after visiting Katjaa's sister when the outbreak started.

Meeting Lee and Clementine along the way, they decided to stick together for a better chance of survival. Kenny acted as a co-leader of Lee's group (but eventually acknowledged Lee as the true leader) but his short temper and failure to think things through often got the better of him. However, Kenny is also shown to be selfless and kind, being willing to give his life to save someone else's. 

Kenny often went sailing to the open sea for months at a time, separated from his family, which he admits to be a fact that he deeply regrets after his son gets bitten by a zombie and his wife commits suicide because of the loss of Duck.

Kenny displays numerous stereotypes of a redneck and suffers from insomnia.","[3097, 1871, 2911]",Kenny,0,"In <The game>, there's many main characters and one of them is <the character>. As a kid <he/she/they> was raised by <his/her/their> father, who taught <him/her/them> how to repair broken cars. That knowledge soon extended to boats due to <his/her/their> love of the water and traveling. As an adult, <the character> became a commercial fisherman, hunting for snapper fish and yellow fin. During a fishing trip, <he/she/they> found a sick octopus and decided to bring it to a veterinarian's office. There <he/she/they> met and fell in love with <a character>. They got married and later had a son called <a character> Jr, also nicknamed <a nickname>. The family were returning from <a location>, after visiting <a character>'s sister when <a past event> started.

Meeting <a character> and <a character> along the way, they decided to stick together for a better chance of survival. <the character> acted as a co-leader of <a character>'s group (but eventually acknowledged <a character> as the true leader) but <his/her/their> short temper and failure to think things through often got the better of <him/her/them>. However, <the character> is also shown to be selfless and kind, being willing to give <his/her/their> life to save someone else's. 

<the character> often went sailing to the open sea for months at a time, separated from <his/her/their> family, which <he/she/they> admits to be a fact that <he/she/they> deeply regrets after <his/her/their> son gets bitten by a zombie and <his/her/their> wife commits suicide because of the loss of <a nickname>.

<the character> displays numerous stereotypes of a redneck and suffers from insomnia."
1043,"Booker DeWitt (Troy Baker), the player protagonist, is a disgraced former agent of the Pinkerton National Detective Agency. As a soldier in the 7th Cavalry Regiment, he had performed brutal acts against native American Indians at the Battle of Wounded Knee to defend his own honor; these acts left him emotionally scarred, leading to excessive drinking and gambling and earned him the title ""White Injun"" due to his tendency to scalp those he killed. He was given an opportunity to be baptised and start anew, but ultimately declined. He was subsequently dismissed for behavior beyond the acceptable bounds of the Agency,[2] but considers his actions with the Pinkertons in quelling labour strikes to be among his many sins. He continues to work as a private investigator from New York City, referring to himself as an ""independent contractor"". Outwardly, he cares little for the extraordinary, provided that it does not interfere with his ability to do his job; internally, he is disturbed by both his role in the events at Wounded Knee and recurring visions of New York City under attack from the air. Booker is skeptical of faith, unwilling to accept the idea that he can be absolved of his sins by embracing religion, as he considers his sins to be so extreme as to demand a penance rather than forgiveness.",[538],Booker DeWitt,0,"<the character>, the player protagonist, is a disgraced former agent of <an organization>. As a soldier in <an organization>, <he> performed brutal acts against native peoples at <a past event> to defend <his> own honor; these acts left <him> emotionally scarred, leading to excessive drinking and gambling and earned <him> the title ""<an artifact>"" due to <his> tendency to scalp those <he> killed. <He> was given an opportunity to be baptized and start anew, but ultimately declined. <He> was subsequently dismissed for behavior beyond the acceptable bounds of <an organization>, but considers <his> actions with <an organization> in quelling labour strikes among <his> many sins. <He> continues to work as a private investigator from <a location>, referring to <himself> as an ""independent contractor"". Outwardly, <he> cares little for the extraordinary, provided that it does not interfere with <his> ability to do <his> job; internally, <he> is disturbed by both <his> role in the events at <a past event> and recurring visions of <a location> under attack from the air. <the character> is skeptical of faith, unwilling to accept the idea that <he> can be absolved of <his> sins by embracing religion, as <he> considers <his> sins so extreme as to demand a penance rather than forgiveness."
3196,"Born in april 9 1967 
lives in a Penthouse in Las Vegas, Nevada. 
Saved the world from alien invasion multiple time, work with the EDF (Earth Defence Force)","[4130, 342]",Duke Nukem,0,"Born on April 9, 1967  
lives in a penthouse in <a location>.  
Saved the world from alien invasions multiple times, works with <an organization>."
11953,Samuel is a minor character in The Curse of Dwight Periwinkle.,,Bouncer Samuel,0,<the character> is a minor character in <The game>.
3475,"Matt is the high school's star linebacker, but he isn't necessarily the sharpest tool in the box. He's hoping for a sports scholarship to a top college, because his GPA isn't going to cut the mustard.

He mostly plays the part of the big friendly giant - but when Matt stays red, it's best to stay out of his way...

Matt is fiercely loyal to his girlfriend Emily... maybe even too loyal. Their relationship could be described as being a little one-way: when Emily says something, Matt does it.","[3097, 7609, 1958]",Matthew Taylor,0,"<the character> is the high school's star linebacker, but <he/she/they> isn't necessarily the sharpest tool in the box. <he/she/they>'s hoping for a sports scholarship to a top college, because <his/her/their> GPA isn't going to cut the mustard.

<he/she/they> mostly plays the part of the big friendly giant - but when <the character> stays red, it's best to stay out of <his/her/their> way...

<the character> is fiercely loyal to <the character>... maybe even too loyal. Their relationship could be described as being a little one-way: when <the character> says something, <the character> does it."
9205,"The Skeleton King is a boss character found in Diablo 3, formerly known as King Leoric. Even though he was born in Kehjistan, Leoric decided to take his family and travel into the lands of Khanduras, where he in the name of the Zakarum, declared himself as the king. At first, the people of Khanduras disliked the idea to have him as a ruler. However, as time passed, they grew to like and respect him, thanks to his purity of heart and deed.

Unknown to Leoric however, his seat of power was the resting place of Diablo. He used the people too free himself from imprisonment, and took Leoric as his host for his evil deeds. Leoric tried to fight against it for a long time, but initially failed as Diablo stripped his soul from all honor and virtue. The people of Khanduras started to see a change in their king and how he became deformed and insane. He soon became cruel, and didn't hesitate to kill anyone or anything who dared to oppose him. Leoric even decided to execute Queen Asylla, his own wife. That's when he got the new nickname: ""The Black King"". 

One day, Leoric's lieutenant, the knight Lachdanan, came back from war, only to find his king mad and crazy, accusing people for kidnapping his son. Lachdanan begged for an explanation, but Leoric simply spat at him, calling him and his men traitors. With sadness in his heart, Lachdanen killed his king and Leoric cursed the knights just before his death.

King Leoric got a proper burial, but Diablo didn't want to give him that peace and raised him from the dead as a powerful undead warlord called the Skeleton King.",,The Skeleton King,0,"<the character> is a boss character found in <The game>, formerly known as <the character>. Even though <he> was born in <a location>, <the character> decided to take <his> family and travel into the lands of <a location>, where <he> in the name of <an organization>, declared <himself> as the king. At first, the people of <a location> disliked the idea to have <him> as a ruler. However, as time passed, they grew to like and respect <him>, thanks to <his> purity of heart and deed.

Unknown to <the character> however, <his> seat of power was the resting place of <it>. <It> used the people too free <itself> from imprisonment, and took <the character> as <its> host for <its> evil deeds. <the character> tried to fight against it for a long time, but initially failed as <it> stripped <his> soul from all honor and virtue. The people of <a location> started to see a change in their king and how <he> became deformed and insane. <He> soon became cruel, and didn't hesitate to kill anyone or anything who dared to oppose <him>. <the character> even decided to execute <the character>, <his> own spouse. That's when <he> got the new nickname: ""The Black King"". 

One day, <the character>'s lieutenant, the knight <the character>, came back from war, only to find <his> king mad and crazy, accusing people for kidnapping <his> son. <the character> begged for an explanation, but <the character> simply spat at <him>, calling <him> and <his> men traitors. With sadness in <his> heart, <the character> killed <his> king and <the character> cursed the knights just before <his> death.

<the character> got a proper burial, but <it> didn't want to give <him> that peace and raised <him> from the dead as a powerful undead warlord called <the character>."
8950,"Rigby is one of the protagonists of Carton Networks' Regular Show, as well as a playable character in the online game Fusion Fall. He's a 23 year old brown raccoon with short, spiky hair and made his debut in the pilot episode, working in the park as a groundskeeper. Rigby received the nickname ""The One Cheek Wonder"", after a friend damaged his butt in a ""fun"" fight. The raccoon had to get surgery that resulted in his behind looking like it only had one butt cheek.

Described as a ""wild adult"", he often becomes frightened, confused, frustrated or sad very easily. He can also be very impulsive, impatient and arrogant at times, his behavior causing him to act more like a child. Rigby cares a lot about his friends and tries to help the best he can.

Rigby is prone to overly dramatic reactions to the simplest things and often tries to skip work and disobey orders. However, as the series progressed, he has become a bit more responsible and thoughtful, tending to complain less and even accomplishing tough tasks.

He's terrified of horror movies.",,Rigby,0,"<the character> is one of the protagonists of <The game>, as well as a playable character in the online game <the game>. <he/she/they>’s a 23 year old brown raccoon with short, spiky hair and made <his/her/their> debut in the pilot episode, working in the park as a groundskeeper. <the character> received the nickname ""The One Cheek Wonder"", after a friend damaged <his/her/their> butt in a ""fun"" fight. The raccoon had to get surgery that resulted in <his/her/their> behind looking like it only had one butt cheek.

Described as a ""wild adult"", <he/she/they> often becomes frightened, confused, frustrated or sad very easily. <he/she/they> can also be very impulsive, impatient and arrogant at times, <his/her/their> behavior causing <him/her/them> to act more like a child. <the character> cares a lot about <his/her/their> friends and tries to help the best <he/she/they> can.

<the character> is prone to overly dramatic reactions to the simplest things and often tries to skip work and disobey orders. However, as the series progressed, <he/she/they> has become a bit more responsible and thoughtful, tending to complain less and even accomplishing tough tasks.

<he/she/they>’s terrified of horror movies."
4479,"Zinyak is an extraterrestrial warlord and the bad guy in Saint's Row IV. He's the leader of the alien race known as the Zin. Sounding very posh, he speaks with an upper class English accent and is a big fan of literature. It was actually the love for books that brought him to Earth. Zinyak often makes references from famous work, such as Macbeth and Edgar Allan Poe. 

During the events of the game, he invades Earth and comes through the ceiling of the White House where he abducts Kinzie Kensington and Shaundi before disappearing. He also defeats the Boss, who is now the President of the United States, and puts him/her into a virtual simulation based on their worst fears. 

Zinyak live streams everything to his planet where all the Zin can watch how he slowly but surely kills the humans and erases mankind. His goal is to take over, not really thinking that anyone on Earth can be strong enough to stop him.",[1981],Zinyak,0,"<the character> is an extraterrestrial warlord and the bad guy in <The game>. <he> is the leader of the alien race known as <an organization>. Sounding very posh, <he> speaks with an upper class English accent and is a big fan of literature. It was actually the love for books that brought <him> to Earth. <the character> often makes references from famous work, such as Macbeth and Edgar Allan Poe.

During the events of the game, <he> invades Earth and comes through the ceiling of <a location> where <he> abducts <the character> and <the character> before disappearing. <he> also defeats the Boss, who is now the President of the United States, and puts <him/her> into a virtual simulation based on <their> worst fears.

<the character> live streams everything to <a location> where all the <an organization> can watch how <he> slowly but surely kills the humans and erases mankind. <his> goal is to take over, not really thinking that anyone on Earth can be strong enough to stop <him>."
2052,"As The Tower's evil has grown, so has his stature. He is trapped inside armor that will not grow with him, and his agony is exquisite. He was once a Númenórean and as he can recall, he either built a tower, or was locked inside one. 
 
His appearance is horrific. To stand near him is to feel the revulsion he feels for himself. Even his fellow Captains despise The Tower, although they have come to rely on his great corrupting evil. His propensity for slaughter is unmatched. He makes his victims feel his pain, and he revels in it.",[3025],The Tower,0,"As <the character>'s evil has grown, so has <his> stature. <He> is trapped inside armor that will not grow with <him>, and <his> agony is exquisite. <He> was once a <an organization> and as <he> can recall, <he> either built a tower, or was locked inside one.

<His> appearance is horrific. To stand near <him> is to feel the revulsion <he> feels for <himself>. Even <his> fellow Captains despise <the character>, although they have come to rely on <his> great corrupting evil. <His> propensity for slaughter is unmatched. <He> makes <his> victims feel <his> pain, and <he> revels in it."
7209,Peach Wilkins is a resident of Neptune's Bounty and seems to be one of the leaders of Frank Fontaine's smuggler group.,[20],Peach Wilkins,0,<the character> is a resident of <a location> and seems to be one of the leaders of <an organization>.
5096,"Jam Kuradoberi is a character in the Guilty Gear series. She is of Chinese descent, and is one of the few characters in the game who fights bare-fisted, supplemented with Ki force. 
 
Jam stands 5'4"" tall, with long brown hair worn in a waist-length loop and secured at the top of her head with a ""Pokka"" Oolog tea can. She has brown eyes, fair skin, and a very athletic physique. 
 
Jam's costume is a tight-fitting Chinese-styled dress of red silk and black trim. It has no sleeves and falls to about the top of her thighs and is cut high over the hip. Under this she wears a second skirt, which is white with red trim and about the same length as the red dress (but it covers her hips, which the red dress doesn't). On her arms she wears wide ""sleeves"" made from red silk with black trim. These sleeves are held on by straps at her upper bicep. On her feet Jam wears high-heeled red boots with black trim. 
 
Jam is a woman who often jumps to conclusions and is quick to make decisions, while taking the consideration of others into account. In Guilty Gear XX, she immediately got into fights with the other characters, suspecting them as the arsonists who burnt her restaurant down. Jam also takes great pride in her Chinese heritage and skill in both fighting and cooking, often using food as a reference. Overall, she is a very energetic person who is sometimes a little silly, but still tries to establish friendships.",[9141],Jam Kuradoberi,1,"<the character> is a character in <The game>. <she> is of Chinese descent, and is one of the few characters in the game who fights bare-fisted, supplemented with Ki force. 

<the character> stands 5'4"" tall, with long brown hair worn in a waist-length loop and secured at the top of <her> head with a ""Pokka"" Oolog tea can. <she> has brown eyes, fair skin, and a very athletic physique. 

<the character>'s costume is a tight-fitting Chinese-styled dress of red silk and black trim. It has no sleeves and falls to about the top of <her> thighs and is cut high over the hip. Under this <she> wears a second skirt, which is white with red trim and about the same length as the red dress (but it covers <her> hips, which the red dress doesn't). On <her> arms <she> wears wide ""sleeves"" made from red silk with black trim. These sleeves are held on by straps at <her> upper bicep. On <her> feet <the character> wears high-heeled red boots with black trim. 

<the character> is a <woman> who often jumps to conclusions and is quick to make decisions, while taking the consideration of others into account. In <The game>, <she> immediately got into fights with the other characters, suspecting them as the arsonists who burnt <her> restaurant down. <the character> also takes great pride in <her> Chinese heritage and skill in both fighting and cooking, often using food as a reference. Overall, <she> is a very energetic person who is sometimes a little silly, but still tries to establish friendships."
4991,"Daxter is a central character in the ""Jak and Daxter"" video game series. Originally a human, Daxter is transformed into an ottsel, a fictional hybrid of an otter and a weasel, after falling into a pool of Dark Eco. Known for his witty and outspoken personality, Daxter serves as Jak's loyal sidekick and best friend. Despite his small stature, he is resourceful, brave, and provides comic relief throughout their adventures. Daxter's unique transformation and humorous nature make him a memorable and indispensable part of the duo.","[1528, 1529]",Daxter,0,"<the character> is a central character in <the game> video game series. Originally a human, <the character> is transformed into an ottsel, a fictional hybrid of an otter and a weasel, after falling into a pool of <an artifact>. Known for <he/she/they> witty and outspoken personality, <the character> serves as the protagonist’s loyal sidekick and best friend. Despite <his/her/their> small stature, <he/she/they> is resourceful, brave, and provides comic relief throughout their adventures. <the character>’s unique transformation and humorous nature make <him/her/them> a memorable and indispensable part of the duo."
