id,description,games,name,character_gender,obfuscated_description
3155,"The character Doctor Ivo ""Eggman"" Robotnik is the man antagonist of the Sonic the Hedgehog franchise, created by Sega. Being a mad scientist, he constantly plans to conquer the world in order to fulfill his dream: to build his own Eggman Empire. He's the archenemy of Sonic, and wants to do everything in his power to stand as the last winner. Spme of Eggman's basic characteristics is his egg-shaped body, his sunglasses, his clothing in red, black and yellow, as well as his very large mustache.

Outside of appearing in almost every Sonic the Hedgehog video game, he's also a recurring character in other media such as comics, animations and novels.

Eggman loves machines and is often described as a genius with an IQ of 300. He doesn't care for others' opinions and never gives up on his desire to build the ultimate ""utopia"". Whoever interrupt his plans, becomes a prime threat and a target. Although Sonic has always ruined his evil plans, Eggman holds a secret respect for his determination.

Many of the robots in the earlier games are actually animals that Robotnik trapped in mechanical outfits. These are the same animals that Sonic frees at the end of each level.","[5322, 103018, 7858]",Dr. Eggman,0,"The character <the character> is the <man> antagonist of <The game> franchise, created by <an organization>. Being a mad scientist, <he> constantly plans to conquer the world in order to fulfill <his> dream: to build <his> own <an organization>. <He>’s the archenemy of <the character>, and wants to do everything in <his> power to stand as the last winner. Some of <the character>’s basic characteristics are <his> egg‑shaped body, <his> sunglasses, <his> clothing in red, black and yellow, as well as <his> very large mustache.  

Outside of appearing in almost every <The game> video game, <he> is also a recurring character in other media such as comics, animations and novels.  

<The character> loves machines and is often described as a genius with an IQ of 300. <He> doesn’t care for others’ opinions and never gives up on <his> desire to build the ultimate utopia. Whoever interrupts <his> plans becomes a prime threat and a target. Although <the character> has always ruined <his> evil plans, <the character> holds a secret respect for <his> determination.  

Many of the robots in the earlier games are actually animals that <the character> trapped in mechanical outfits. These are the same animals that <the character> frees at the end of each level."
10467,"Circus Baby (commonly referred to as Baby) is the secondary antagonist of the Five Nights at Freddy’s series and the animatronic mascot of Circus Baby's Pizza World invented by Afton Robotics, LLC and made for Fazbear Entertainment, Inc.

Baby is haunted by the soul of Elizabeth Afton, who was the daughter of the serial killer William Afton. However, during the completion ending, Elizabeth's soul was presumably set free.",[115304],Circus Baby,1,"<the character> (commonly referred to as <the character>) is the secondary antagonist of <The game> and the animatronic mascot of <a location> invented by <an organization> and made for <an organization>.

<the character> is haunted by the soul of <the character>, who was the daughter of the serial killer <the character>. However, during the completion ending, <the character>'s soul was presumably set free."
1453,"Geralt of Rivia (or Geralt z Rivii in Polish) is a witcher and the main protagonist of The Witcher game series by CD Project RED. However, he originally comes from a series of books with the same name, written by Andrzej Sapkowski. As a witcher and a monster hunter, you can hire him for anything, as long as he gets paid for it. Geralt possesses nearly superhuman abilities and is an expert with swords. During The Witcher 3: Wild Hunt (in 1272), Geralt's mentor Vesemir says that he is ""nearly a century old"".

Geralt's mother, Visenna, left him with the witchers in Kaer Morhen, where he grew up. During this time, to appear more trustworthy to future clients, young witchers were encouraged to make up surnames for themselves. Geralt wanted to pick ""Geralt Roger Eric du Haute-Bellegarde"", but Vesemir saw the names as silly and unprofessional, leaving him with Geralt, and Geralt only. Even though he didn't come from Rivia, ""Of Rivia"" was a practical alternative as a last name. Geralt adopted the name and even started to talk with a Rivian accent so that he would appear more authentic. Except from that name, the dryads gave him the nickname ""The White Wolf"".

During the ""Trial of the Grasses"", Geralt survived numerous mutations, and he was one of the few who survived. That's why his hair is white (no pigment), and his senses better and stronger than others. When his witcher training was over, he embarked on his horse called Roach (giving the same name to every one of his horses), to become the slayer of monsters.

For his services, as a reward, Geralt wanted the unborn child of princess Pavetta. However, when he found out that it was a girl, he decided not to take her. But fate caused Geralt and Pavetta's daughter Ciri to cross paths multiple times, and after the death of queen Calanthe (Ciri's grandmother), The White Wolf decided to take care of the girl. He soon came to love her as his own daughter.

Geralt's love of his life is called Yennefer of Vengerberg, and he also has a really close friend that goes by the name Dandelion. He's a poet and a bard with a wild imagination and a love for girls.","[478, 80, 1942, 76885]",Geralt of Rivia,0,"<the character> (or <the character> in Polish) is a <an organization> and the main protagonist of <The game> by <an organization>. However, <he> originally comes from a series of books with the same name, written by <an author>. As a <an organization> and a monster hunter, you can hire <him> for anything, as long as <he> gets paid for it. <the character> possesses nearly superhuman abilities and is an expert with swords. During <The game> (in 1272), <the character>'s mentor <a character> says that <he> is ""nearly a century old"".

<the character>'s mother, <a character>, left <him> with the <an organization> in <a location>, where <he> grew up. During this time, to appear more trustworthy to future clients, young <an organization> were encouraged to make up surnames for themselves. <the character> wanted to pick a long name, but <a character> saw the names as silly and unprofessional, leaving <him> with <the character>, and <the character> only. Even though <he> didn't come from <a location>, ""Of <a location>"" was a practical alternative as a last name. <the character> adopted the name and even started to talk with a <a location> accent so that <he> would appear more authentic. Except from that name, <an organization> gave <him> the nickname ""The White Wolf"".

During the ""<a past event>"", <the character> survived numerous mutations, and <he> was one of the few who survived. That's why <his> hair is white (no pigment), and <his> senses better and stronger than others. When <the character>'s <an organization> training was over, <he> embarked on <his> horse called <a name> (giving the same name to every one of <his> horses), to become the slayer of monsters.

For <his> services, as a reward, <the character> wanted the unborn child of <a character>. However, when <he> found out that it was a girl, <he> decided not to take <her>. But fate caused <the character> and <a character>'s daughter <a character> to cross paths multiple times, and after the death of <a character> (<a character>'s grandmother), <the character> decided to take care of the girl. <he> soon came to love <her> as <his> own daughter.

<the character>'s love of <his> life is called <a character>, and <he> also has a really close friend that goes by the name <a character>. <he> is a poet and a bard with a wild imagination and a love for girls."
7155,"Delilah is the deuteragonist of Firewatch and the supervisor of Henry, the game's protagonist. Henry remains in nearly constant contact with her via radio and can be reached at any time she or Henry starts a conversation or Henry finds something worth of reporting to her, except during sections taking place in the cave. As the game progresses, increasing doubt is shed on Delilah, her relationship with Henry, her affiliation and what she potentially knows. As such, the player has the choice when making discoveries to report to her or not. The player never meets Delilah in person, leaving her appearance a mystery.","[9730, 6574]",Delilah,1,"<the character> is the deuteragonist of <The game> and the supervisor of <the character>, the game's protagonist. <the character> remains in nearly constant contact with <her> via radio and can be reached at any time <she> or <he> starts a conversation or <he> finds something worth of reporting to <her>, except during sections taking place in the cave. As <The game> progresses, increasing doubt is shed on <the character>, <her> relationship with <the character>, <her> affiliation and what <she> potentially knows. As such, the player has the choice when making discoveries to report to <her> or not. The player never meets <the character> in person, leaving <her> appearance a mystery."
3459,"Good looking, smooth as silk, and silver-tongued, Mike is the resident ladykiller. He's had more girlfriends than he's had hot dinners, which can cause a few problems when a few of them are in his immediate circle of friends...

Mike is a man of action. He's always the first to volunteer, the first to make a suggestion. With a narcissistic streak, there's no denying that he likes the attention that comes with being the man who stands up and can get things done.","[8576, 7609, 180]",Michael Munroe,0,"Good looking, smooth as silk, and silver‑tongued, <the character> is the resident ladykiller. <he/she/they>'s had more girlfriends than <he/she/they>'s had hot dinners, which can cause a few problems when a few of them are in <his/her/their> immediate circle of friends...

<the character> is a man of action. <he/she/they>'s always the first to volunteer, the first to make a suggestion. With a narcissistic streak, there's no denying that <he/she/they> likes the attention that comes with being the man who stands up and can get things done."
8156,"Morrigan Aensland is a fictional character in the video game series Darkstalkers. She first appeared in Darkstalkers: The Night Warriors. She is an anti-hero and a main protagonist alongside Demitri Maximoff. 
 
Morrigan Aensland is a succubus who was born in 1678 in a region of Scotland. Belial foresaw that Makai would be exposed to the crisis of perishing soon. Someone, a great Life Form, would be needed to maintain the unbalanced world of Makai. He foresaw that one with such power would not be born in the family of Aensland for another 1,200 years. Knowing this, he decided to leave the future of the Aensland family in Morrigan's hands. To Belial, the future of the Aensland family was the same as the future of Makai. 
 
Beautiful, sexy, confident, conceited, and playful, Morrigan may be called many things given that she is a succubus, but she is not truly evil despite her heritage as a demon of the Makai realm. Instead she is friendly and approachable, perhaps in part due to her frequent visits to the material world to pursue her hedonistic tendencies and has found herself willingly aligned with the forces of good on many occasions. Morrigan is always out to satisfy her hunger and will often shirk her responsibilities as the current head of the Aensland estate to find something more engaging.",,Morrigan Aensland,1,"<the character> is a fictional character in the video game series <The game>. <she> first appeared in <The game>. <she> is an anti-hero and a main protagonist alongside <a character>.

<the character> is a succubus who was born in 1678 in a region of <a location>. <a character> foresaw that <a location> would be exposed to the crisis of perishing soon. Someone, a great Life Form, would be needed to maintain the unbalanced world of <a location>. <they> foresaw that one with such power would not be born in the family of <an organization> for another 1,200 years. Knowing this, <they> decided to leave the future of <an organization> in <the character>'s hands. To <a character>, the future of <an organization> was the same as the future of <a location>.

Beautiful, sexy, confident, conceited, and playful, <the character> may be called many things given that <she> is a succubus, but <she> is not truly evil despite <her> heritage as a demon of <a location>. Instead <she> is friendly and approachable, perhaps in part due to <her> frequent visits to the material world to pursue <her> hedonistic tendencies and has found <themself> willingly aligned with the forces of good on many occasions. <the character> is always out to satisfy <her> hunger and will often shirk <her> responsibilities as the current head of <an estate> to find something more engaging."
3161,"Miles ""Tails"" Prower, from the Sonic the Hedgehog franchise by Sega.","[5322, 103018]",Tails,0,"<the character>, from <The game>."
11042,"This character is from TES 5 Skyrim mod called Bruma. 
 
A khadjit who lives in Bruma. Originally from Elsweyr Dar'taqto has lived most of his life in Cyrodil. He says that he moved from Elsweyr so long ago that does not rememder what the reason was. Maybe he just doens't want to tell the reason. 
 
Dar'taqto seems to have warm feelings towards Elsweyr. He can even tell the protagonist ""You are to Dar'taqto as the sun is to Elsweyr... I mean - a good friend"". 
He says that he would like to become emperor one day. It seems that he is dissapointed in current emperor. 
 
Dar'taqto gets banned from Bruma but the protagonist can help him by taking him along as follower. 
 
He fights enemies with two battle axes. Dar'taqto wears light armor. 
 
WARNING: The outfit on the picture is not his original outfit. The picture is taken at Skaal Village, Soltheim.",[19221],Dar'taqto,0,"This character is from <The game> mod called <a location>.

A <a race> who lives in <a location>. Originally from <a location> <the character> has lived most of <their> life in <a location>. <they> says that <they> moved from <a location> so long ago that does not remember what the reason was. Maybe <they> just doesn't want to tell the reason.

<the character> seems to have warm feelings towards <a location>. <they> can even tell the protagonist ""You are to <the character> as the sun is to <a location>... I mean - a good friend"".

<they> says that <they> would like to become emperor one day. It seems that <they> is disappointed in current emperor.

<the character> gets banned from <a location> but the protagonist can help <them> by taking <them> along as follower.

<they> fights enemies with two battle axes. <the character> wears light armor.

WARNING: The outfit on the picture is not <their> original outfit. The picture is taken at <a location>."
6165,Nick Valentine is a synth detective and potential companion living in Diamond City. He is found in Vault 114 in 2287.,[9630],Nick Valentine,0,<the character> is a synth detective and potential companion living in <a location>. <he> is found in <a location> in <a past event>.
1044,"Elizabeth is a character and A.I. companion in BioShock Infinite.
With the game set in 1912 on a sky city (named Columbia) , Elizabeth is to take over the city once its current leader (or ""Prophet""), Father Comstock, dies. Elizabeth can make and exploit ""tears"", rips to other universes, allowing her to move between them and/or bring in items from them. To prevent her from leaving Columbia, a remote ""Siphon"" is made which limits her powers, and she is locked in a tower under study and guarded by a giant mechanical bird known as Songbird.","[538, 11416, 19297, 54220, 54218]",Elizabeth,1,"<the character> is a character and A.I. companion in <The game>. With the game set in 1912 on a sky city <a location>, <the character> is to take over the city once its current leader (or ""Prophet""), <an organization> dies. <the character> can make and exploit ""tears"", rips to other universes, allowing <her> to move between them and/or bring in items from them. To prevent <her> from leaving <a location>, a remote <an artifact> is made which limits <her> powers, and <she> is locked in a tower under study and guarded by a giant mechanical bird known as <an artifact>."
1053,"Alan Wake was born and raised in New York City. He developed a passion for writing at a young age, eventually leading to a successful novelist career. His most famous works are thriller novels, which have earned him a large and dedicated following. Despite his success, Alan struggles with writer's block and personal issues, including a strained relationship with his wife, Alice.

In an attempt to overcome his writer's block, Alan and Alice take a vacation to the idyllic town of Bright Falls. However, their peaceful retreat quickly turns into a nightmare when Alice disappears under mysterious circumstances. Alan discovers pages of a manuscript he doesn't remember writing, detailing events that start to come true in real life.

As he searches for Alice, Alan encounters dark supernatural forces known as the ""Taken,"" shadowy entities controlled by a malevolent presence called the ""Darkness."" He learns that the town and its surroundings are influenced by this dark power, which has trapped him in a nightmarish reality where his own writing becomes a weapon and a tool for survival.

A crucial figure in Alan's journey is Thomas Zane, a poet who lived in Bright Falls decades earlier and had a similar encounter with the Darkness. Zane’s writings and his struggle against the Darkness provide Alan with clues and guidance on how to fight supernatural forces.

In the end, Alan realizes that to save Alice and stop the Darkness, he must make a significant sacrifice. He writes a conclusion to the horror story he is trapped in, allowing Alice to escape while he remains in the dark, nightmarish world beneath Cauldron Lake. This act of self-sacrifice shows his character's deep love for his wife and his determination to end the cycle of terror.","[1062, 2602, 3750]",Alan Wake,0,"<the character> was born and raised in <a location>. <he/she/they> developed a passion for writing at a young age, eventually leading to a successful novelist career. <his/her/their> most famous works are thriller novels, which have earned <he/she/they> a large and dedicated following. Despite <his/her/their> success, <the character> struggles with writer's block and personal issues, including a strained relationship with <his/her/their> wife, <a person>.

In an attempt to overcome <his/her/their> writer's block, <the character> and <a person> take a vacation to the idyllic town of <a location>. However, their peaceful retreat quickly turns into a nightmare when <a person> disappears under mysterious circumstances. <the character> discovers pages of a manuscript <he/she/they> doesn't remember writing, detailing events that start to come true in real life.

As <he/she/they> searches for <a person>, <the character> encounters dark supernatural forces known as <an organization>, shadowy entities controlled by a malevolent presence called <an organization>. <he/she/they> learns that the town and its surroundings are influenced by this dark power, which has trapped <he/she/they> in a nightmarish reality where <his/her/their> own writing becomes a weapon and a tool for survival.

A crucial figure in <the character>'s journey is <a figure>, a poet who lived in <a location> decades earlier and had a similar encounter with <an organization>. <their> writings and <their> struggle against <an organization> provide <the character> with clues and guidance on how to fight supernatural forces.

In the end, <the character> realizes that to save <a person> and stop <an organization>, <he/she/they> must make a significant sacrifice. <he/she/they> writes a conclusion to the horror story <he/she/they> is trapped in, allowing <a person> to escape while <he/she/they> remains in the dark, nightmarish world beneath <a location>. This act of self-sacrifice shows <his/her/their> deep love for <his/her/their> wife and <his/her/their> determination to end the cycle of terror."
3463,"Clementine, affectionately nicknamed Clem or Sweet Pea, is one of the main characters in the game The Walking Dead, by Telltale Games. She's not playable in season one, but the story still involves heavily around her. She is kind, polite and very mature for her age, acting as a moral compass of the group. Clementine is remarkably smart and good when it comes to improvising. She can be very practical during dire situations. She's more careful than other kids as she is aware of the current events going on. However, despite her maturity, Clementine is still relatively innocent in the way children are.

During the outbreak, Clementine ends up hiding in her tree-house after her babysitter goes missing, and her parents doesn't return home from vacation. A guy called Lee (the playable character) soon finds her and decides to take her with him after having to battle the babysitter who died and became a zombie. Together they embark on a long journey to find safety and eventually becomes very fond of each other.

After losing the people closest to her, Clementine becomes hardened and more mature in her outlook, but still bravely overcomes the dangers of a post-apocalyptic world head-on and tries her best to maintain some of her previous faith in humanity, hanging on to what Lee taught her and her own values.","[3097, 1871]",Clementine,1,"<the character>, affectionately nicknamed Clem or Sweet Pea, is one of the main characters in <The game>. <she>'s not playable in season one, but the story still involves heavily around <her>. <she> is kind, polite and very mature for <her> age, acting as a moral compass of the group. <the character> is remarkably smart and good when it comes to improvising. <she> can be very practical during dire situations. <she>'s more careful than other kids as <she> is aware of the current events going on. However, despite <her> maturity, <the character> is still relatively innocent in the way children are.

During the outbreak, <the character> ends up hiding in <her> tree‑house after <her> babysitter goes missing, and <her> parents doesn't return home from vacation. <another character> soon finds <the character> and decides to take <the character> with <him> after having to battle the babysitter who died and became a zombie. Together they embark on a long journey to find safety and eventually become very fond of each other.

After losing the people closest to <her>, <the character> becomes hardened and more mature in <her> outlook, but still bravely overcomes the dangers of a post‑apocalyptic world head‑on and tries <her> best to maintain some of <her> previous faith in humanity, hanging on to what <another character> taught <her> and <her> own values."
11954,"Big-Foot/Sasquatch the names don't matter but the legend remains the same. Thought to be nothing more than superstition by Native's of the land; the Big-Foot is half man, half beast in the form of a hairy ape. 
 
The beast is rumored to have the strength of ten men and the ferocity of a grizzly bear, in Terrordrome the Sasquatch is neither friend nor foe, it simply wants to be left in peace but the chaos going on around it has caused it to awaken from it's slumber and take the fight back to the enemy.",,Sasquatch,2,"<the character> the names don't matter but the legend remains the same. Thought to be nothing more than superstition by natives of the land; <the character> is half man, half beast in the form of a hairy ape.  

The beast is rumored to have the strength of ten men and the ferocity of a grizzly bear, in <The game> <the character> is neither friend nor foe, <they> simply wants to be left in peace but the chaos going on around <them> has caused <them> to awaken from <their> slumber and take the fight back to the enemy."
